播放董斌主持的情感咨询热线	Radio-Listen
四月一五日在苏州为左麟右李中国巡回演唱会造势	Video-Play
帮我创建一个周一下午2点去北京的闹钟。	Alarm-Update
金莎和林俊杰合唱的歌曲随机来一首	Music-Play
我要你把明天上午的提醒全部取消	Alarm-Update
昨天没扫地，打开扫地机器人。	HomeAppliance-Control
不要忘记在明天三点半提醒我拿道具	Alarm-Update
建一个6月7号下午6点去买菜的提醒	Alarm-Update
告诉我答案农历9月19是11月3日还是11月4日啊	Calendar-Query
济南发往沈阳的大巴明天有没有票	Travel-Query
查询明天安徽东部会下雨吗	Weather-Query
星期几是美国的大蒜节	Calendar-Query
打开长春的气温预报	Weather-Query
开车到嘉陵小学怎么走	Travel-Query
帮我拨一下张楠主持的1039新闻早报	Radio-Listen
明天记得叫我去野炊	Alarm-Update
想看薛之谦认真的雪的幕后花絮	Video-Play
东营到莱芜的17号11点的汽车票查一下	Travel-Query
离开的时候把空调关了啊	HomeAppliance-Control
英文演奏的萨克斯有没有推荐的	Music-Play
杭州最近有风吗	Weather-Query
今年的偶像剧随机来一个可以吗	FilmTele-Play
立刻播放一个音乐类的湖北人民广播电台交通音乐台	Radio-Listen
阿拉伯语言的歌曲随机来一首可以不	Music-Play
现在删除10月4号去我姐姐家的那个提醒	Alarm-Update
我想知道去东莞的客车是几点的呀	Travel-Query
请收听音乐类的黄石交通音乐台	Radio-Listen
单曲循环2016年的歌曲不为谁而作的歌	Music-Play
熔炉是不是一部改变了国家法律的韩国电影	FilmTele-Play
我准备做坐明天上午十点到天津的飞机	Travel-Query
邓紫棋翻唱的手心的蔷薇打开听会儿	Music-Play
播放你是我的命中注定第10集	FilmTele-Play
中午12:30的火车票的闹钟	Alarm-Update
明天下午4点的外教课帮我设定下。	Alarm-Update
快点帮我设置一个明天早上10点做美甲的闹钟。	Alarm-Update
把卧室的空调开到十八度	HomeAppliance-Control
古筝版本的高山流水立刻播放呢	Music-Play
记得给我建一个备忘录9月8号去军营	Alarm-Update
回威海的开大巴车的路线告诉我一下	Travel-Query
空调风速调至4就行	HomeAppliance-Control
定一个6月13号下午3点和同学打排球的行程。	Alarm-Update
回看CCTV3综艺频道的向幸福出发-2021-18五一二护士节	Radio-Listen
30秒以后查询星期几是圣诞节	Calendar-Query
我要听广播调到FM98点1的四川电台	Radio-Listen
我想你让我知道8月20日和8月19日哪天是星期日呢	Calendar-Query
2019年肖战的剧是不是可以给我播放	FilmTele-Play
你帮我设定个周三上午10点论文答辩的闹钟。	Alarm-Update
将明天下午3点前交付文件的行程设置一下。	Alarm-Update
你明天早上还要上班呢	Alarm-Update
周六海南湿度多少	Weather-Query
考试的时候他传纸条给我	Alarm-Update
近期快手火爆的歌曲给随机来一首吧	Other
张东主持的西马讲书播放出来	Radio-Listen
可以试试蒸烤箱的3D热风模式不	HomeAppliance-Control
帮我规划到常州的路线	Travel-Query
具体查询一下遵义开来的大巴是16点的吗	Travel-Query
给我播放青春有你2的一公比赛视频	Video-Play
想吃湖北的家常菜，有视频教学吗	Video-Play
2021年华晨宇唱歌的视频找一个出来	Video-Play
快快的查询一下江门开过来的高铁今天有票吗	Travel-Query
明天是周几呀	Calendar-Query
现在把空气净化器调到自动模式	HomeAppliance-Control
建党节是几月几号	Calendar-Query
查询后天兰州会出现降雨吗	Weather-Query
查询山西后天的气温	Weather-Query
帮我把床头灯打开一下好吗	HomeAppliance-Control
目的地马来西亚2月2号的机票查一下	Travel-Query
你可以将去植物园的最短路线告诉我一下吗	Travel-Query
有萨克斯吹的回家吗，就是专辑浪漫萨克斯里的	Music-Play
1999年发行的歌都播放一遍呢	Music-Play
中央9的藏着的森林还有的看吗帮我看下	TVProgram-Play
是不是能把连续剧继续播一下呢	FilmTele-Play
国庆节是几月几日	Calendar-Query
我想知道明天长沙的温度是多少。	Weather-Query
给我播放一下去年中国抗击新冠疫情的视频	Video-Play
孤独这首歌可以单曲循环一下啊	Music-Play
请为我设置一个周二下午的闹钟，我要看直播呢	Alarm-Update
风太小了，把风扇调到三档风速好吗	HomeAppliance-Control
是不是能继续收听频率是一零六点一的茂名人民广播电台	Radio-Listen
给我查去高新工业科技园的路	Travel-Query
空调风调至50	HomeAppliance-Control
我想看陈伟霆演古剑奇谭的个人花絮视频	Video-Play
可以帮我回放今早七点的西安新闻吗我想看下	Video-Play
怎么走才能到银川兴庆集散中心	Travel-Query
给我转一下4月26号的王者荣耀竞技赛现场	Video-Play
是不是能继续前面的频率九七点八的河源人民广播电台	Radio-Listen
请记得提醒我周六下午3点去浇地。	Alarm-Update
开始循环放一下春日忆李白这首诗吧	Audio-Play
冯小刚导演的剧情类电影播放一个吧	FilmTele-Play
麻烦播放大欢演唱的三生石下	Music-Play
让你播放八爪鱼绘画的相关视频呢啊	Video-Play
绝地求生比赛的视频播一下	Video-Play
请帮我调到幺零零点六零频率的北京广播电台	Radio-Listen
咱这儿明天有西北风吗几级	Weather-Query
帮我打开厨房的灯吧，要做晚餐了	HomeAppliance-Control
你能给我播放一下韩剧W两个世界吗	FilmTele-Play
空调风速调小两个格呀	HomeAppliance-Control
讲一下打火匣的故事英文版的	Audio-Play
我要看一个90年代的恐怖片呢	FilmTele-Play
REVISIT里面的歌曲随机来一首吧，张国荣的	Music-Play
建一个备忘录周一至周五下午4:30打卡	Alarm-Update
浴室好冷啊，帮我把浴霸调成强暖模式吧	HomeAppliance-Control
将微波炉打开，我要加热食物。	HomeAppliance-Control
我希望当我醒了电视能自动打开播放新闻	HomeAppliance-Control
创建一下30号上午8点10分开晨会的提醒。	Alarm-Update
查询明天泰山雷雨天气	Weather-Query
给我放一个美国流行音乐排行第一的mv	Video-Play
想听四川广播电台的新闻联播	Radio-Listen
去年的美国科幻片播放一个吧	FilmTele-Play
快点查查几月几号是这个周三呢	Calendar-Query
请给我调出幺零零点七的江都人民广播电台	Radio-Listen
未来三天芜湖天气怎么样	Weather-Query
打开今天的江苏综艺看看吧	TVProgram-Play
回放上周五刺激战场竞技赛的视频	Video-Play
是不是能给我随机来一首凤凰传奇的歌	Music-Play
尽快设置个今天晚上9点看NBA球赛的闹钟。	Alarm-Update
给我找一下到天安门的路	Travel-Query
好几天没有刮风了周三也不会刮风吧查一下	Weather-Query
会你觉得大家应否予卫诗机会	Music-Play
问除了安全感你给很多人的印象是善良完美的新好男人形象	Music-Play
调到客家天地听听在CNR神州之声呢	Radio-Listen
鼓曲大师骆玉笙的剑阁闻铃你听过吗	Music-Play
我想要删除9号和今天下午5点的备忘录	Alarm-Update
循环播放赵本山的小品听	Audio-Play
给我来一个音乐类的湖北人民广播电台交通音乐台	Radio-Listen
大连到哈尔滨的机票显示一下	Travel-Query
你的笑容已经非常卡哇伊	Music-Play
我要听老妖主持的素人广播	Radio-Listen
播放英文歌曲more than this	Music-Play
她对其他人都有笑容而对我是冷淡是什么原因	Other
6点有北京去沈阳的火车吗	Travel-Query
把洗衣机开启脱水模式吧，我想让衣服快点干	HomeAppliance-Control
推理剧继续给我播放一下	FilmTele-Play
播放欧美动漫正义联盟	Video-Play
清除明天下午所有的闹钟	Alarm-Update
找其他王一博主演的古装剧播放可以吗，除了有匪	FilmTele-Play
咽喉疼痛可以吃西瓜霜润喉片吗	Radio-Listen
给我查看一下今天有丽江飞来上海的飞机不	Travel-Query
怎么开车去农博汇啊	Travel-Query
顺序播放易烊千玺的中文歌。	Music-Play
请帮我转播4月10日的英雄联盟竞技赛的现场	Video-Play
在7:50提醒我去金泰转呀	Alarm-Update
麻烦调到FM91点4成都电台交通广播	Radio-Listen
岳阳市周三需不需要多加衣物防寒保暖。	Weather-Query
听一个林溪主持的毛泽东的故事	Radio-Listen
随机播放一首手风琴演奏的意大利语歌	Music-Play
随便播放一首马头琴演奏的音乐	Music-Play
我要看下一站幸福的第十集呢	FilmTele-Play
廊坊的紫外线会偏高吗	Weather-Query
麻烦回访一下凌晨四点十分的世界看湖南	TVProgram-Play
我需要一首2000年的英语歌曲听听呀	Music-Play
后天晚上10点闹钟你定好了吗	Alarm-Update
蚌埠经济广播电台在104点2给我拨一下	Radio-Listen
我要放些三文鱼，帮我让变温抽屉开到冰鲜档	HomeAppliance-Control
到湖南常德怎么走才到	Travel-Query
找给我一个这个时间在教做饭的生活电台	Other
请帮我查查劳动节是农历几月几日	Calendar-Query
几月几号是关门节	Calendar-Query
从我这儿到紫金蓝塘怎么走	Travel-Query
我正在循环播放星辰大海	Music-Play
调高空调温度	HomeAppliance-Control
放一个刘谦表演的魔术来看	Video-Play
适合运动的歌曲来一首吧	Other
胡可自立门户华谊捧唐山挽留	Radio-Listen
一定要在明天早上8点叫我哦	Alarm-Update
播一个放英文歌的电台	Radio-Listen
立刻找出来华为MatePad10.8的测评视频	Video-Play
定一个8月23号下午5点参加朋友聚会的行程。	Alarm-Update
我国传统节日清明节是哪一天啊	Calendar-Query
我想把电热毯的温度调高一点。	HomeAppliance-Control
看过国外许多末日科幻电影后流浪地球并没给我带来太多惊喜	FilmTele-Play
我想看傅欣瑶在酒吧驻唱的音乐视频	Video-Play
附近的天然气加油站怎么走	Travel-Query
单曲循环一首适合雨天听的纯音乐	Music-Play
准备休息了，切换到空调的睡眠模式吧	HomeAppliance-Control
法语比较浪漫的歌曲是不是能来一首啊	Music-Play
播放曹操的短歌行	Audio-Play
找一下日本动漫冰菓	Video-Play
听一会儿FM106.6小霍主持的综艺对对碰	Radio-Listen
霍元甲给我继续播放吧	FilmTele-Play
5月4日发生的青春有你倒牛奶事件的视频找一下	Video-Play
把4月20提醒我截图改为每天提醒	Alarm-Update
我想看今年到今天为止播放量最高的古装剧	FilmTele-Play
播放大陆片外交风云，这个剧把六十年代的外交历史形象的演绎出来了	FilmTele-Play
调FM104点5旅游之声听听1045family	Radio-Listen
可以帮我把空调调到22度吗	HomeAppliance-Control
周几是雪顿节	Calendar-Query
给我放一下梓君主持的水晶盒故事	Radio-Listen
看看是不是哈尔滨开往沈阳的复兴号进站了呢	Travel-Query
随机给我来一首二胡曲子可以不	Music-Play
唱一首英文流行歌曲呢	Music-Play
播一下晚上22点更新的中流击水的介绍视频	Video-Play
洗衣机的浸泡时间改为三十分钟	HomeAppliance-Control
查询未来一周江南会大幅度降雨吗	Weather-Query
给我再一次播放2011年羽毛球世锦赛林丹对盖德的男单半决赛的视频	Video-Play
其实莫扎特的小夜曲听着非常享受	Music-Play
后天下午三点会下雨吗？	Weather-Query
想听一下英文歌 找FM88点7	Radio-Listen
农历的什么时候是七夕节	Calendar-Query
飞深圳的飞机起飞了吗	Travel-Query
看佟丽娅在2021年春晚上唱歌的视频	Video-Play
设置一个后天上午8点去医院复诊的闹钟	Alarm-Update
我想知道内蒙古今天的空气质量指数。	Weather-Query
我要去阳曲县怎么走	Travel-Query
继续收听晓婷主持的今日路况速报	Radio-Listen
今天晚上建几个新的闹钟	Alarm-Update
我想知道今天北京的体感温度是多少	Weather-Query
麻烦找下5月3日十二点的中国新闻	Video-Play
查下日历大前天是农历多少	Calendar-Query
洗衣机节能模式帮我开下	HomeAppliance-Control
看一下珠江的第九个寡妇	Music-Play
回忆一下上周六海淀是雨天吗	Weather-Query
能不能放一下过去现在时里面的眼泪	Music-Play
查询明天沧州会出现雨夹雪情况吗	Weather-Query
我想听郑州电台的怀旧好声音	Radio-Listen
母亲节是在今年的几月几号？	Calendar-Query
能找一个2008年的古装偶像看看不	FilmTele-Play
丽江的空气质量稳定吗	Weather-Query
我现在想听古典音乐阳春白雪笛子版	Music-Play
我需要你在后天八点提醒我给周老板发会议内容	Alarm-Update
香港明天会下雨吗？	Weather-Query
杭州明天是晴天吗	Weather-Query
播放日语歌泪的物语	Music-Play
调至空调最大风速好吧	HomeAppliance-Control
设置25号去医院打针	Alarm-Update
福建的空气质量如何	Weather-Query
明天上午10点去接小孩放学的闹钟帮我设置一下	Alarm-Update
1月1号是农历的哪天	Calendar-Query
放个民谣歌曲，比如陈粒的历历万乡	Music-Play
中秋节是在星期六吗	Calendar-Query
我想听pig小优版本的画舫烟中浅	Music-Play
东京未来一周的温度是多少？	Weather-Query
我想要重温2020年谢娜和肖战在央视春晚演的喜欢你喜欢我	Video-Play
我要查下周末从长治去海口的飞机票。	Travel-Query
高新区的平安保险大厦杠哪里	Travel-Query
共有几列火车可在兖州火车站办理客运业务	Travel-Query
张家边火炬开发区新艺物流公司	Radio-Listen
放一下小虎队的《青苹果乐园》	Music-Play
怎么没有看到我下载的QQ浏览器	Other
给我找出5月27日17点播出的动漫	Video-Play
帮我插上电饭煲的电源。	HomeAppliance-Control
来一首丝竹行街听听	Music-Play
帮我接上回放一下凤归四时歌	FilmTele-Play
我想让衣服快点干，把洗衣机调成单烘干模式吧	HomeAppliance-Control
组图詹妮弗加纳背女秀母爱穿雨衣似亲子装	Video-Play
你能帮我播一下杨新宇和王之导演的这个世界不看脸吗	FilmTele-Play
我要看大陆的古装剧红楼梦	FilmTele-Play
好啦关掉客厅的灯吧	HomeAppliance-Control
明天中午12点吃药的闹钟帮我设置一下。	Alarm-Update
把之前收藏的3月6日更新的奇葩说放了	Video-Play
随机来一首薛之谦的歌曲吧	Music-Play
给我找到到银星镇的路线	Travel-Query
帮我回放国防军事频道兵器面面观-2021-90节目	TVProgram-Play
找一首颜人中的歌儿听	Music-Play
去年的电视剧清平乐现在播放一下第一集	FilmTele-Play
请告诉我如何才能步行去海边呢	Travel-Query
是否可以播放经济类电台中央电台经济之声啊	Radio-Listen
动漫黑衣人第一季帮我找一下吧	Video-Play
我要订去大阪的飞机票	Travel-Query
查查杭州飞广州的飞机是12点的吗	Travel-Query
帮我设置个周一上午8点半办理社保卡的闹钟。	Alarm-Update
天气好干，湿度器升到70吧	HomeAppliance-Control
帮我订1张沈阳到广州的T181次列车软卧票	Travel-Query
明天海南的紫外线指数多少	Weather-Query
帮我把蒸烤箱切换到3D热风模式	HomeAppliance-Control
太热了，把空调调到最低温	HomeAppliance-Control
帮我看一下五月二十三号星期几	Calendar-Query
综艺节目说唱新世代的相关视频帮我查询一下	Video-Play
我要到武汉大学正门怎么走	Travel-Query
悄悄的告诉我去武汉的飞机是几点的啊	Travel-Query
记得帮忙关掉电脑	HomeAppliance-Control
帮我看一看农历7月18和农历7月19哪天是9月2号啊	Calendar-Query
明天提醒我下午两点钟去接妹妹	Alarm-Update
2021年张哲瀚唱歌的视频找一个出来	Video-Play
快帮我播放MYFM不眠夜	Radio-Listen
播放一人之下中王也和张楚岚对战的片段	Video-Play
4月10号下午的备忘录全部删除	Alarm-Update
2000年左右的歌曲给我随机来一首	Music-Play
贵阳那边天气怎么样	Weather-Query
每天9点截图的提醒以后都不用再提醒了	Alarm-Update
株洲北到徐州北的高铁票还有吗	Travel-Query
我要去王府井，马上为我导航	Travel-Query
打开电视切换到河北卫视	Radio-Listen
播放屠洪刚的专辑风云2里面的歌曲	Music-Play
我要看会书，帮我把台灯开启阅读模式	HomeAppliance-Control
2021年全国女子体操锦标赛前三名的精彩片段视频给我回放一下吧	Video-Play
看一部2020年韩国最火的爱情剧	FilmTele-Play
今天晚上8点的提醒给我删除	Alarm-Update
谢明明是男的还是女的	Other
可以帮我把蒸烤箱切换到童锁功能不	HomeAppliance-Control
明天绍兴紫外线指数怎么样	Weather-Query
能把教育类的广东人民广播电台教育之声帮我调出来吗	Radio-Listen
打开CCTV15音乐看看在播放什么歌曲	TVProgram-Play
我今天想喝果汁，把榨汁机打开。	HomeAppliance-Control
可以帮我把冰箱变温抽屉调成冷鲜模式吗	HomeAppliance-Control
除夕在几月几号呀	Calendar-Query
我想看18年上线的动作类电影呢	FilmTele-Play
随即来一首适合睡觉的钢琴曲吧	Music-Play
能不能现在就把音响关掉，我想睡觉	HomeAppliance-Control
播放陈情令的有声小说	Audio-Play
首联写英雄气是做一个高度的总结就是说刘备永垂不朽的意思	Alarm-Update
你帮我找一个韩国的恐怖僵尸电视剧播放	FilmTele-Play
星期二是农历几月几日	Calendar-Query
是否可以来一个频率是一零一点二的黄石新闻台啊	Radio-Listen
是不是能告诉我4月2日和4月4日哪天是农历2月初6呢	Calendar-Query
我要知道近一周甘肃气温升降变化	Weather-Query
据日本警视厅透露酒井承认了犯罪事实	FilmTele-Play
帮我查询明天南京室外温度多少度	Weather-Query
给我来一个美国的漫威系列电影钢铁侠1吧	FilmTele-Play
随便来一首寻宝游戏里面的歌曲呢	Music-Play
可不可以帮我把空调温度调到20度呀	HomeAppliance-Control
我想听能让人平静下来的钢琴演奏曲	Music-Play
麻烦帮我播放河山	FilmTele-Play
空调调到20度行不行呢	HomeAppliance-Control
下周四南通的空气质量怎么样	Weather-Query
空调可以调到18度吗	HomeAppliance-Control
继续播放一下杨幂的古装剧可以不	FilmTele-Play
麻烦请帮我设置下周三上午10点10分飞往巴黎的闹钟。	Alarm-Update
阔什节是什么时候	Calendar-Query
立即收听申远演播的环球旅行家	Radio-Listen
是不是可以播放一下去年的谈莎莎主演的悬疑片你是她	FilmTele-Play
大后天上海会很热吗	Weather-Query
能找到一个2009年的美剧播放吗	FilmTele-Play
放邓紫棋的手心的蔷薇可以吗	Music-Play
我想把卧室的床头灯调到柔和光	HomeAppliance-Control
有没有英国今年上映的剧情片看，或者战争片也行	FilmTele-Play
4月30日的棒球周刊还有回放吗帮我看下	TVProgram-Play
香港降雨情况怎么样	Weather-Query
当我听到这首歌的时候她在我心里还是二零多岁的样子	Music-Play
请用英文放国王与鹤这个故事	Audio-Play
周杰伦新出的专辑听下呢	Music-Play
孙茜演的枫叶红了1点75倍速播	FilmTele-Play
拜托就查查端午节是不是星期一	Calendar-Query
圣瓦伦丁节是什么时候	Calendar-Query
准备收拾房间，让洗衣机开始洗衣服吧	HomeAppliance-Control
山西社会与法治的公民与法给我播放下	TVProgram-Play
昆明气温变化会偏大吗	Weather-Query
稍小点客厅空调风速	HomeAppliance-Control
五大连池最近是晴天吗	Weather-Query
准备出门，把家里所有的灯都关掉吧	HomeAppliance-Control
有没有关于海洋的纪录片，那就帮我播放世上最老的海吧	Video-Play
请循环收听费磊主持的分类讲话电台节目	Radio-Listen
是不是能来一个频率是九零点九的襄樊新闻台啊	Radio-Listen
给我搜索在武汉纪录片	Video-Play
空调风速调大点到百分之30	HomeAppliance-Control
陕西农林卫视的三农信息联播可以给我回放下吗我想看下	Radio-Listen
长春冷死了这儿有零下几度了	Weather-Query
28号下午1点多选婚纱的行程帮我设定一下。	Alarm-Update
快给我查询阴历的几月几号是6月3日啊	Calendar-Query
点一首邓丽君的月亮代表我的心	Music-Play
范冰冰参演的美国大片给我来一个	FilmTele-Play
可以帮我看下取暖器温度吗	HomeAppliance-Control
给我随便放个动画片	Video-Play
播放美国电影冰雪奇缘	FilmTele-Play
我要听胡凡主持的凡事想开点	Radio-Listen
下周二是农历多少号	Calendar-Query
我是真的想要知晓2021年的青年节是不是农历8月12啊	Calendar-Query
立即说一下5点有飞南京的飞机吗	Travel-Query
记得在5月6号通知我去看话剧	Alarm-Update
我想听一个2011年的英文歌	Music-Play
关了空气净化器好吧	HomeAppliance-Control
我想找单依纯清唱隐形的翅膀的视频	Video-Play
把电饭煲调为保温模式。	HomeAppliance-Control
8月11号和8月13号的日程不要再提醒了	Alarm-Update
帮我找蔡徐坤的情人	Music-Play
播放一个李准基主演的电视剧的介绍视频	Video-Play
今天晚上23点的闹钟打开	Alarm-Update
你现在给我记住后天通知我回娘家	Alarm-Update
找到白羊街的步行路线	Travel-Query
放动漫哈尔的移动城堡	Video-Play
现在可以帮我将4月20号的备忘录修改成4月29号吗？	Alarm-Update
潘粤明主演的喜剧可以播放一个不或者那个盗墓的也挺好的	FilmTele-Play
我想喝热水，热水机帮我把水煮到100度吧	HomeAppliance-Control
下周三晚上大庆需要多加衣物吗？	Weather-Query
今年的摩洛哥新娘节是农历的哪天	Calendar-Query
言语之间古天乐一直把拐杖抓得很紧貌似在强忍疼痛	Music-Play
帮我查下G51动车还有票吗	Travel-Query
请告诉我答案阴历的几月几号是12月5日啊	Calendar-Query
我需要一首能让我睡觉的钢琴曲呢	Music-Play
麻烦帮我创建一个8号下午两点参加英语考试的提醒。	Alarm-Update
上元节是农历几月几号	Calendar-Query
蘑菇香菇金针菇能一起吗	Music-Play
广西那边的经典歌可以随机放一首不	Music-Play
请循环播放古诗江上吟	Music-Play
给我听频率是九四点九的扬州人民广播电台经济台	Radio-Listen
开车回家怎么走才不绕远呢	Travel-Query
兰州这边会不会下雨啊	Weather-Query
想知道黑龙江10号还下雨吗	Weather-Query
你是不是能给我来一首搞笑的日语歌呢	Music-Play
给我找一个阴阳师抽卡的视频	Video-Play
给我找一个泰国版的公主罗曼史看看	FilmTele-Play
今天有点冷啊，帮我把空调设置为制热吧	HomeAppliance-Control
属于REVISIT的同道中人立刻播放一下吧	Music-Play
有点冷啊空调帮我关掉	HomeAppliance-Control
后天下午3点多去市场进货的行程提醒我一下。	Alarm-Update
北京今天空气质量好吗	Weather-Query
放90年代出版的电影小鞋子。	FilmTele-Play
我想吃烤鱼，蒸烤箱开机预热到200度吧	HomeAppliance-Control
明天要去青岛出差，那边天气多少度	Weather-Query
帮我播放海贼王的第一集我是路飞将要成为海贼王的男人	Video-Play
明天上海空气污染指数是良吗	Weather-Query
而且这次的组织也比较成功	Other
我想知道六月天津紫外线指数是不是较高。	Weather-Query
今天是礼拜几呀	Calendar-Query
法语歌立刻随机来一首吧	Music-Play
我想了解宇宙，帮我回放4月1日播放的宇宙大奥秘吧	Video-Play
麻烦帮我播放宋佳佟大为蒋欣演的小舍得	FilmTele-Play
张学友1984年的大地恩情播放呢	Music-Play
5月9号大连会不会刮大风啊	Weather-Query
怎么到涟水法院查一下	Travel-Query
水浸传感器给我关闭呀	HomeAppliance-Control
听一下重庆之声的身边说法	Radio-Listen
语音报一下礼拜几是9月的13日	Calendar-Query
播放南京地区频率为八九点七的CityFM音乐广播	Radio-Listen
我想知道锦兴区办理公交车月票的地方	Weather-Query
创建20号晚上7点去看演唱会的日程	Alarm-Update
看一下蓝盈盈主演的精英律师怎么样。	FilmTele-Play
给我放频率是九零点零的辽宁资讯可以吗	Radio-Listen
请打开左右次卧所有的窗	HomeAppliance-Control
马上给我订几张上海到济南的机票	Travel-Query
单曲循环相亲相爱一家人	Music-Play
6月1号上午10点带着孩子去公园的闹钟设置一下吧。	Alarm-Update
是否可以随机播放莱芙里的歌呢	Music-Play
我想听70年代的纯音乐	Music-Play
我要听交换余生里面的歌，随机播放就可以	Music-Play
贺岁的话那就请给我播放西游降魔篇	FilmTele-Play
得知是一名台湾着名主持人后孙海英回答不认识	Radio-Listen
于波杨俊毅他们两个人结婚了没	Music-Play
打开烤箱的开关按钮	HomeAppliance-Control
请调低一点温度空调的	HomeAppliance-Control
黄安传灯里面的歌曲随机来一首吧	Music-Play
现在给我播恐怖小说午夜凶铃日文版的	Audio-Play
想了解一下湖北8月的空气湿度	Weather-Query
我要听花木兰这个小故事	Audio-Play
你可以播放一首90年代的法语歌曲给我听吗	Music-Play
请播放两集下一站是幸福。	FilmTele-Play
查一查昆明会不会下暴雨。	Weather-Query
农历的雨水是什么时候	Calendar-Query
等半个小时后关掉电视	HomeAppliance-Control
后天下午3点给妈妈做皮肤护理的闹铃帮我开启一下吧。	Alarm-Update
现在播放北京地区的新闻	Video-Play
