查一下到洛杉矶的机票	Travel-Query
合肥空气质量较好吗	Weather-Query
查查看合肥去往郑州的客车哪天有票呢	Travel-Query
查一查中国的阴历7月初7是什么节日呢	Calendar-Query
今早的快乐生活一点通晚上还有重播吗帮我看下	TVProgram-Play
跳到上海戏剧广播中的越剧大观园	Radio-Listen
我想要看暖暖请多指教给我找一下	FilmTele-Play
麻烦找到去新华第二小学的路	Travel-Query
找一下孙燕姿的逆光	Music-Play
至于礼物小表示还在考虑当中到时你们就会知道了	Other
播放腾格尔天堂的现场版	Music-Play
我要听盖世英雄专辑里面的歌曲呢，随机来一首呗	Music-Play
而卫诗因涉藏海洛英一直被扣押遭日警扣押六零日	Audio-Play
帮我把冷冻室的湿度调到零下16度行不行呢	HomeAppliance-Control
下个月5号朋友的婚礼，提醒我哦	Alarm-Update
扫地机器人帮我关了吧	HomeAppliance-Control
帮我找刘旭晚8点到9点的城市娱乐报	Radio-Listen
我想收听石家庄新闻广播的交警热线，这是童谣主播的节目	Radio-Listen
这个智能音响可以打开，我想听听歌	HomeAppliance-Control
提醒我周日上午8点去交电费	Alarm-Update
2021年8月20号建立提醒看中秋晚会	Alarm-Update
能不能马上帮我将5月8号的提醒修改成4月29号	Alarm-Update
陈妍希在演艺圈已拼搏了五年时间	FilmTele-Play
明晚天津会下雪吗	Weather-Query
江苏新闻广播高爽主持的节目快帮我播放一下	Radio-Listen
帮我找一个晚间情感电台	Radio-Listen
把邓超结婚的视频找出来	Video-Play
农历的3月18是星期几	Calendar-Query
创建18号上午11点抢车票的日程	Alarm-Update
我想知道洛阳今晚需不需要多加衣物。	Weather-Query
现在上一个6号晚上13点的铃	Alarm-Update
农历的哪天是蚂拐节	Calendar-Query
查询一下韶关开来的动车是今天的吗	Travel-Query
花好月圆人团圆一年一年又一年	FilmTele-Play
快点儿找到FM96点2的宝山区人民广播电台	Radio-Listen
播放扬琴演奏的节日的天山	Music-Play
帮我找在上海王俊凯出席新品发布会的视频	Video-Play
能不能查查宝鸡开过来的客车是几点呢	Travel-Query
请问能帮我查询一下端午节是不是周一	Calendar-Query
查询明早沈阳会大幅度降水吗	Weather-Query
帮我回放5月12日的财经的开门大吉	TVProgram-Play
运动后我想观看一下由王家卫导演的电影春光乍泄。	FilmTele-Play
帮我看一下端午节是星期几	Calendar-Query
看看今年中国传统节日端午节是星期几啊	Calendar-Query
收听朱卫东的创业道路电台节目	Radio-Listen
请循环收听张亮主持的办法总比困难多	Radio-Listen
循环放亲密爱人	Music-Play
帮我查一下明后两天西雅图的天气	Weather-Query
冰箱冷藏调到八度	HomeAppliance-Control
立刻给我查查大理去往贵阳的动车今天有吗	Travel-Query
空调的通风模式打开了吗	HomeAppliance-Control
我想看2021年CBA总决赛广东VS辽宁那一场比赛视频	Video-Play
星期二天津会下雨吗	Weather-Query
快告诉我阴历的四月十八是礼拜6还是礼拜5	Calendar-Query
我想看一个今年上线的刘涛演的电视剧呢	FilmTele-Play
马上瞅瞅几月几号是建党节	Calendar-Query
嗯呐朱莉主演的电视剧朱莉快逃播放给我看看可以吗	FilmTele-Play
听晓彤的I畅游生活	Radio-Listen
能让空调风小到百分之60吧	HomeAppliance-Control
听周六城市越洋疯就潘纳主持的	Radio-Listen
3月10号下午三点的提醒请不要提醒我	Alarm-Update
我想听东郭先生和狼的故事	Audio-Play
有事要出去，帮我把微波炉关上吧	HomeAppliance-Control
想去公园玩儿，这周末天气怎么样呢？	Weather-Query
是不是能播放一首德国的古典音乐呢	Other
北京今天空气怎么样是良还是什么	Weather-Query
提醒我明天回家时买一袋纸	Alarm-Update
超级市场该怎么坐公交车去呢	Travel-Query
综艺节目我是特优声帮我查询一下	Video-Play
立即设置一个9点提醒我关灯的闹铃	Alarm-Update
我需要你唱一首比较搞笑的流行音乐	Music-Play
请给我转播4月19日的王者荣耀竞技赛	Video-Play
播一个格林童话里的故事英文版的来听	Audio-Play
我想立即知道宁波开往郑州的高铁后天有票吗	Travel-Query
我是特种兵这个战争片立刻放给我	FilmTele-Play
半小时后帮我把微波炉里的饭菜热热吧	HomeAppliance-Control
尽管之后汤唯遭遇了封杀曾一度消失	FilmTele-Play
设置未来10天连续提醒我学习签到	Alarm-Update
频率是一零七点七的中央电台音乐之声可以收听下给我不	Radio-Listen
我想看看元宵节是周几	Calendar-Query
收听频率是一零七点三的十堰新闻台	Radio-Listen
播放周日上的王牌对王牌	Video-Play
帮我查查明天上午有没有去平江的汽车票	Travel-Query
B站上的有点心机又如何的相关视频快点给我播放	Video-Play
放一下宫崎骏的动漫片龙猫第30分钟的片段	Video-Play
贾玲的你好李焕英已经出了，赶紧播放给我	FilmTele-Play
能不能单曲循环凤凰传奇的歌	Music-Play
告诉我台湾这周有台风吗	Weather-Query
给我查路我要去太古里	Travel-Query
在路上了呢好像有点迷路了	Other
请给我提醒6号九点看奥运会开幕式	Alarm-Update
我就爱听我们的时光这首流行歌	Music-Play
按顺序播放苏州曲艺广播里面的越剧类节目	Radio-Listen
给我播一个悬疑小说七宗罪	Audio-Play
我要看一遍倩女幽魂，要张国荣版的哦	FilmTele-Play
回放刘涛11月7号在跨界歌王的演唱视频	Video-Play
五年前唐嫣的剧随便来一个	FilmTele-Play
2015年四川幼儿体操比赛视频还能找到吗	Video-Play
我想看单依纯在为歌而赞唱的如此的纯享版音乐视频	Video-Play
想看特别关注，麻烦给我打开新闻吧	Other
快点帮我播放养父的花样年华	FilmTele-Play
把空调调的低一点儿	HomeAppliance-Control
播放吉林下周的气温情况	Weather-Query
你不要只删除明天的提醒，9号的备忘录也给我删除了	Alarm-Update
放一下2021年天津春晚岳云鹏孙越的相声	Video-Play
我说我的手机刚才掉地上摔坏了	Other
帮我转到今天晚上六点的广西天气预报	Radio-Listen
播放九十年代的涛声依旧，不要翻唱的	Music-Play
我说你把卧室遮阳帘给我开开	HomeAppliance-Control
爱情吸引导演陈健吴军郑昊拍摄现场飙戏	FilmTele-Play
我想要你在10月7号叫我给我女儿买奶粉	Alarm-Update
我现在要听罗泽中主持的岁月静好	Radio-Listen
陈奕迅一首歌一个故事里面的歌曲随机来一首	Music-Play
你能不能随机来一首古筝弹奏的歌曲啊	Music-Play
2019年陈鸿宇的专辑三旬里的歌曲随机来一个啊	Music-Play
5月24号沈阳紫外线强不强啊	Weather-Query
继续播放来那个言情剧吧	FilmTele-Play
帮我取消26号去超时购物的提醒	Alarm-Update
我想你继续播放一下五月的青春	FilmTele-Play
石家庄电台的吃喝玩乐搜城记这个节目很有趣，我想听一听	Radio-Listen
你怎么老是听不懂我说的话呢	Other
给我放一下国外新闻埃特纳火山再次喷发的视频	Video-Play
美国片速度与激情播放一下呢	FilmTele-Play
找岁月留声机就主播是凡华的那个	Radio-Listen
洗衣机使用完了关机	HomeAppliance-Control
告诉我明天的日历表是多少号	Calendar-Query
南昌去武汉导航怎么走？	Travel-Query
你帮我确认一下哈尔滨开往广州的和谐号进站了没有	Travel-Query
现在只能看美国的吸血鬼日记	FilmTele-Play
怎么走才能快速的不行去修理厂呢	Travel-Query
你看这个地真脏，把扫地机器人的打扫模式打开	HomeAppliance-Control
现在告诉我海口飞北京的航班还有没有头等舱	Travel-Query
请将明天9点的闹钟关闭	Alarm-Update
可不可以帮我看看7月12日和7月14日哪天是农历6月初8呢	Calendar-Query
现在想看60年代的推理剧	FilmTele-Play
帮我查看纪录片酒美的中国有多少集	Video-Play
搜索查询明早江宁是否会下雨	Weather-Query
想听最好的都给你了，要余佳运给我唱	Music-Play
放侠客行这首诗来听	Audio-Play
找一个2019年经典励志的纪录片来看	Video-Play
空调风速稍微小点有点儿吹	HomeAppliance-Control
那我的手机号码是多少	Other
15号的备忘录不要在15号提醒我了	Alarm-Update
放葫芦兄弟精彩合集给小孩看	Video-Play
我现在要听约翰.斯坦贝克的小说愤怒的葡萄这部小说	Audio-Play
帮我查一下16点有青岛去济南的火车吗	Travel-Query
请不要在5点通知我上网	Alarm-Update
详细播报明早台北的天气情况	Weather-Query
我就要知道D311动车还有票吗	Travel-Query
文艺类的湖北人民广播电台文艺台来一个可以吗	Radio-Listen
找到怎么去肯德基大润发店	Travel-Query
能告诉我明天绥化是晴天吗	Weather-Query
殷桃和宋轶演的爱的理想生活你给我1点5倍速播放一下	FilmTele-Play
大陆动作片西游伏魔篇播放	FilmTele-Play
能不能给我看一看开往漳州的高铁今天有票吗	Travel-Query
国产动漫斗破苍穹帮我找出来	Video-Play
你能随机来一首2000年的歌听听吗	Music-Play
立刻告诉我最快去一班济南飞上海的机票还有几张	Travel-Query
让我知道一下沈阳飞三亚的飞机起飞了吗	Travel-Query
帮我规划一下从深圳到广州的路线	Travel-Query
给我收听李鹏飞主持的马克思主义哲学	Radio-Listen
1984年的大地恩情立刻放一下给我听呢	Music-Play
我想要一首很治愈的德语歌听	Music-Play
请你立刻告诉我答案4月1日是什么节日	Calendar-Query
16点飞巴黎的机票还有吗	Travel-Query
看看给我订一张去南京的商务舱机票	Travel-Query
查查天津下周日是否有雾霾	Weather-Query
快点儿找下到北京的下道	Travel-Query
下月陇西有雪吗	Weather-Query
查找规划一下去体育馆红绿灯最少的路线	Travel-Query
给我把音响关了。	HomeAppliance-Control
2月18号的提醒好了没建	Alarm-Update
你看起来是我喜欢的类型	Other
忏悔节是农历的什么时候	Calendar-Query
尽快设置一个5号下午1点比赛的闹钟。	Alarm-Update
我听的就是黄霄云的星辰大海	Music-Play
请播放马思唯的崂山道士。	Music-Play
明天要补回今天的不足	Weather-Query
接着放第3集葫芦小金刚是动漫啊别放错了	Video-Play
需要智能浴缸接上热水，我要泡个澡	HomeAppliance-Control
但一说起世界杯铁杆球迷辛柏青遗憾不已	FilmTele-Play
悬疑盗墓题材的有声小说随便播一个吧	FilmTele-Play
今明两天大理的空气质量好不好	Weather-Query
明天早上不用让王嘉尔叫我起床	Alarm-Update
后天傍晚会出现沙尘吗	Weather-Query
给1点5倍速播放一下暗恋橘生淮南	FilmTele-Play
我想听FM101.8的都市之声	Radio-Listen
帮我切换到浴霸制热模式	HomeAppliance-Control
韩国的儿童节是哪天	Calendar-Query
请不要忘记通知我在5月30号去打狂犬疫苗	Alarm-Update
打开空调除湿	HomeAppliance-Control
等下12点提醒我要睡觉	Alarm-Update
星期几是愚人节	Calendar-Query
要睡觉了将灯关掉好吗	HomeAppliance-Control
给我找一下到长安的高速路线	Travel-Query
我想听王力宏2010年出的歌呢	Music-Play
8月21号是周几	Calendar-Query
几月几号是寒食节	Calendar-Query
先给我找路我要到北京天安门	Travel-Query
我国首架空客A三八零飞机	Other
3点的提醒给我改下时间	Alarm-Update
把洗衣机这时候关掉吧	HomeAppliance-Control
这周日北京的空气质量如何	Weather-Query
播放一下宋东野的董小姐	Music-Play
我想听频率是一零五点六的恩平电台	Radio-Listen
我想继续播放陈思诚导演的唐探三可以吗	FilmTele-Play
能查一下2018年父亲节是周几吗	Calendar-Query
让我们看个益智类动画啊	Video-Play
杨延东2021年上线的剧播放来看看呢	FilmTele-Play
给我把凤凰传奇的歌顺序播放吧	Music-Play
是否可以帮我将5月6号的备忘录修改成5月29号	Alarm-Update
圣诞节是什么时候	Calendar-Query
告诉我怎么坐车到星海广场	Travel-Query
查询昨天南昌的天气情况	Weather-Query
空调往下调低到26度吧	HomeAppliance-Control
我想听任同祥的唢呐曲到春来	Music-Play
帮我设定一个晚上8点帮宝宝洗澡的日程	Alarm-Update
西安去北京的飞机是几点的啊	Travel-Query
把电扇风速升到最大	HomeAppliance-Control
帮我转下我的第一条微博	Alarm-Update
听说广州天气比我们这边热，大概多少度啊	Weather-Query
你赶紧给我查询一下珠海开过来的高铁哪天才有	Travel-Query
收听一下文艺类的山东文艺广播电台	Radio-Listen
看一下小丽的生日五月初三是几号呀	Calendar-Query
查一下武汉至成都的机票价格。	Travel-Query
给我播放一首巴乌名曲月亮街	Music-Play
随机来一个偶像剧播放第一集呢像微微一笑那种	FilmTele-Play
马上让我知道阴历的几月几号是10月10日啊	Calendar-Query
可以不可以把灯的亮度调高一点	HomeAppliance-Control
从中国去米兰的机票是不是很贵？	Travel-Query
今年抖音最人气的音乐来一首吧	Music-Play
异界九死神功之破茧成蝶四	Music-Play
这一生关于你的风景，我要听隔壁老樊唱的	Music-Play
给我把空调的温度调低一点	HomeAppliance-Control
叶子主持过的上海交通广播节目帮我放一下	Radio-Listen
星期几是龙船节	Calendar-Query
快点儿帮我找一下最近的公厕怎么走	Travel-Query
六一儿童节的农历是几号	Calendar-Query
随便找一个肖战出演的电视剧播放第一集	FilmTele-Play
看会儿王牌对王牌	Video-Play
帮我打开哈尔滨娱乐，我想看食美全橙	TVProgram-Play
10分钟后告诉我什么节日是11月11日啊	Calendar-Query
空气净化器设为强风模式可不可以呢	HomeAppliance-Control
明天在早上5:18的时候叫我穿牛仔外套	Alarm-Update
查询最近沧州是晴天吗	Weather-Query
怎么坐车到五一广场	Travel-Query
找到内蒙古草原之声的故事会听听	Radio-Listen
定一个后天下午1点午休的闹钟。	Alarm-Update
南海气温最高多少度	Weather-Query
在中央人民广播里面找千里共良宵	Radio-Listen
可不可以帮我设置连续20天提醒我跟我父母说早安	Alarm-Update
感觉室内空气太干燥，打开一下加湿器吧	HomeAppliance-Control
提前帮我打开厕所的灯吧	HomeAppliance-Control
现在感觉有点凉了，让空调调高两度吧	HomeAppliance-Control
查询明天武汉会刮大风吗	Weather-Query
把空气净化器打开	HomeAppliance-Control
给我开一下车库门	HomeAppliance-Control
我想要你5号的时候提醒我对我爸爸说生日快乐	Alarm-Update
请单曲循环七里香	Music-Play
来一支钢琴演奏的英文歌曲	Music-Play
帮我放一下98点7福建人民广播电台交通音乐台的节目	Radio-Listen
提醒我今天晚上10点给宝宝换尿不湿	Alarm-Update
吻别这首歌一直循环下去吧	Music-Play
1分钟后告诉我中国的阴历5月17是哪一天呢	Calendar-Query
我想要看老鸟王者荣耀解说视频5月24日那一期的努力上分争取早日国服铠的视频	Video-Play
我想知道昆明明天早上会不会下小雨。	Weather-Query
有点像听90年代的古典歌曲呢	Music-Play
因为你的降临这一天成了一个美丽的日子祝你生日快乐	Calendar-Query
空调风速要放最大啦	HomeAppliance-Control
请你在明天上午九点的时候记得提醒我参加马拉松	Alarm-Update
到陈伟餐厅怎么走	Travel-Query
查询杭州穿衣指数	Weather-Query
10分钟后提醒我	Alarm-Update
给我播放一个法国纪录片脸庞村庄吧	Video-Play
中央交通广播的节目随便播一个，要凡珂主持的哦	Radio-Listen
循环播放古诗青溪	Music-Play
南都娱乐当时周润发片酬很贵吗	FilmTele-Play
能不能调到一个叶痕的我所理解的生活给我呢	Radio-Listen
放一下赵本山小沈阳的小品不差钱吃饭时候听	Audio-Play
帮我找到王月的岷江排行榜	Radio-Listen
放一下嫦娥奔月这个故事给我听	Audio-Play
上周北京上空出现了日晕现象	Weather-Query
近期日照气温会偏高吗	Weather-Query
找几部美国纪录片来放	Video-Play
马上查询一下迪拜飞来的客机是5月2日到吗	Travel-Query
我想知道国庆节下午3:00左右从长春开往沈阳的特快列车还有吗	Travel-Query
不要忘了在今天凌晨12点叫我哟	Alarm-Update
块给我放一个小猫钓鱼的故事	Video-Play
散步时候听循环播一下宋小宝的小品吃放	Audio-Play
没有啊你想到哪里去了正收拾呢	Other
我想听听歌手许嵩的浪	Music-Play
8月10号和8月20号提醒我上班	Alarm-Update
打开音响播放轻音乐	HomeAppliance-Control
有没有沈腾今年播出的喜剧播放一下呢	FilmTele-Play
健康类的湖北人民广播电台健康之声来一个吧	Radio-Listen
赶快查一查几月几号是春节呢	Calendar-Query
找下5月26日的王者荣耀KPL职业联赛	Video-Play
把厨房灯的色温调为白光	HomeAppliance-Control
告诉我大前天是农历多少	Calendar-Query
我想你给我播放一下下一站幸福呢	FilmTele-Play
即刻帮我把台调到蜻蜓fm的歌	Radio-Listen
我想2009年12月24日，汪峰在平安夜于深圳举办不插电演唱会的视频	Video-Play
请你帮我把明天下午所有的闹钟都关闭	Alarm-Update
赶快查询南京飞北京的飞机起飞了没有	Travel-Query
随机播放一首85年的歌曲	Music-Play
帮我查一下5月23日是农历几月几日	Calendar-Query
想了解一下昨天的今日关注，给我回放一下吧	TVProgram-Play
查一下到贵阳的汽车票还有没有	Travel-Query
你快点告诉我T251列车还有票吗	Travel-Query
沈阳飞深圳的飞机起飞了吗	Travel-Query
我需要你来一首2020年的抖音神曲呢	Music-Play
第三届王者荣耀全国大赛有吗，我想看看	Video-Play
那是不然你有钱没地方给	Other
现在我想知道开往青岛的复兴号出发了吗	Travel-Query
我需要听一个频率是九五点一的珠海人民广播电台第一台呢	Radio-Listen
请你提醒我5月6号将商品下架	Alarm-Update
世界无烟日在这个月星期几	Calendar-Query
后天有冷空气过来不会降温不	Weather-Query
丽江到昆明可以坐火车去吗？	Travel-Query
立刻找出来Redmibook Pro 14 锐龙版的测评视频	Video-Play
2021年的小黄瓜电台播放一下	Radio-Listen
帮我打开南昌精品房产吧，想了解今天的房产信息	TVProgram-Play
能回答我星期五是哪个节日吗	Calendar-Query
明天要去廊坊出差，那边天气多少度？	Weather-Query
现在你帮我调到北京交通广播的新闻晚知道	Radio-Listen
银临、河图的专辑蚍蜉渡海播放	Music-Play
帮我找到菏泽的路线	Travel-Query
查一下11点到北京东站的火车票	Travel-Query
听一下频率是九九点六的盐城人民广播电台新闻台	Radio-Listen
把空调调成最低的温度	HomeAppliance-Control
继续播放长春最新的降水情况	Weather-Query
五天后的紫外线很强吗	Weather-Query
循环播放搞笑小品不是冤家不聚头散步时候听	Music-Play
我想知道明天济州岛的天气情况	Weather-Query
前天是哪个节日呢	Calendar-Query
曹云金说他的后车玻璃被砸了并称刘可有砸车的动机	HomeAppliance-Control
给我播放2018年省运会青少年组蹦床比赛的视频	Video-Play
能不能唱一首民谣四块五给我呢	Music-Play
我想找下2011年发生的洛阳性奴案的视频	Video-Play
我要听甜蜜爱情的钢琴曲呢	Music-Play
单曲循环播放李健的抚仙湖。	Music-Play
快告诉我知道星期几是母亲节	Calendar-Query
查看一下12点有上海飞莫斯科的飞机吗	Travel-Query
赶紧告诉我农历5月5是什么节日	Calendar-Query
何江涛本以为高晓松认错态度好会轻一点希望以后都一视同仁就行	Music-Play
7点了找都市夜归人听听	Radio-Listen
等会儿提醒我明天去买蟑螂药	Alarm-Update
泼水节是农历的哪天	Calendar-Query
去长春的飞机票还有吗？	Travel-Query
能不能来一个喜剧甲方乙方	FilmTele-Play
给我播放王赫野的大风吹	Music-Play
明天株洲有大雨吗	Weather-Query
请帮我查询劳动节是农历多少呀	Calendar-Query
播放钟汉良马天宇孙怡演的凉生我们可不可以不忧伤	FilmTele-Play
在六点的时候告诉我要订餐厅了	Alarm-Update
我想知道柳州星期二下午两点半的风向。	Weather-Query
比较想看广东珠江的外来媳妇本地郎，帮我找一下	Video-Play
快给我调回到中国之声的午间新闻	Radio-Listen
日本今年上线的动作片儿有吗？播放一个	FilmTele-Play
重听文艺类的无锡人民广播电台文艺台	Radio-Listen
明日穿衣指数是否为衬衫类的	Weather-Query
重阳节是几月几号	Calendar-Query
雷佳音和陈数演的那个和平饭店我想看	FilmTele-Play
查查冰箱冷藏室的温度是多少	HomeAppliance-Control
好好的看一看发往玉林的大巴明天有没有票	Travel-Query
播放彭冠英主演的因为爱情有奇迹	FilmTele-Play
播放个去年KTV点播量最高的歌曲吧	Music-Play
江门最近晒不晒紫外线强度多少	Weather-Query
提醒我在20分钟之后揭面膜	Alarm-Update
打开用电吉他演奏的海阔天空，要纯音乐版的那个哦	Music-Play
放5月15号和平精英游戏直播的视频	Video-Play
唱一首80年代的古典歌曲给我听听	Music-Play
能放来听岳云鹏的相声祖宗十九代吗	FilmTele-Play
拨到FM93点7铁锟的重点关注	Radio-Listen
立刻找出来戴尔XPS 15的测评视频	Video-Play
九点半看湖南的新闻联播	Radio-Listen
13:20起床去游泳	Alarm-Update
我想确定一下后天的紫外线指数	Weather-Query
你能收听一下频率是一零六点七的大连音乐吗	Radio-Listen
我想查看4月30号的广西影视有什么令人心动的电影帮我看下	TVProgram-Play
麻烦帮我播放FM95点4海口旅游交通广播的节目	Radio-Listen
从西安到武汉坐高铁要几个小时？	Travel-Query
6月25号参加公司高层会议记得提醒我一下	Alarm-Update
现在帮我开启冰箱的智能模式	HomeAppliance-Control
拨到FM97龙光爱家频道听一帮到底	Radio-Listen
看一下18点有沈阳来广州的飞机吗	Travel-Query
佟大为在沪宣传公益活动演十三钗颠覆形象	Video-Play
今年的新米节是什么时候	Calendar-Query
西班牙的著名景观人文风俗名人明星等等	Video-Play
6月3日空气湿度怎么样?	Weather-Query
空调要调低10度	HomeAppliance-Control
请新增备忘录3月2号举办婚礼	Alarm-Update
来一首任然的飞鸟和蝉	Music-Play
周二上午9点45去医院打疫苗的提醒制定一下。	Alarm-Update
请关上训练室的灯	HomeAppliance-Control
1点25倍速播放胡军和孙红雷演的背叛	FilmTele-Play
放一个牛力的广播行走天下来听一下	Radio-Listen
给我继续观看红楼梦可以吗	FilmTele-Play
打开音响，播放歌曲	HomeAppliance-Control
重庆之声里安琪的周末快乐听着太快乐了，现在我要听这个快乐	Radio-Listen
今年重阳节是周几	Calendar-Query
播一个周德东的惊悚小说	Audio-Play
开启老袁的台州早班车听一下明天的天气预报	Radio-Listen
帮我定一个早上7点的闹钟	Alarm-Update
请告知本月视频会议是在周几哦	Calendar-Query
我准备听献给爱丽丝这首钢琴曲	Music-Play
请调到FM97.2的上海戏曲广播	Radio-Listen
厦门周六空气质量好吗	Weather-Query
能继续给我看毒液2吗	FilmTele-Play
我想的是一会儿把电视机打开	HomeAppliance-Control
把你身份证号码发给我嘛	Other
查询明天香港紫外线指数	Weather-Query
给我调到调频93的西安人民广播	Radio-Listen
今年的阔什节是农历的什么时候	Calendar-Query
能播放一下胡彦斌的专辑太歌里的歌吗	Music-Play
现在给我添一个9月19号生日的提醒	Alarm-Update
4:20出发去上海，到时间告诉我哦	Alarm-Update
打开投影仪，我想看最火的一部剧	HomeAppliance-Control
听听余泳欣主持的念念旧就那个电台节目	Radio-Listen
今年的鬼节是农历的什么时候	Calendar-Query
给我放纪录片生门第五集	Video-Play
有声的紫襟讲的都市的小说帮我播一下	Radio-Listen
我马上就要关掉空调	HomeAppliance-Control
大陆的有关鸦片战争的电影能播放一个么	FilmTele-Play
告诉我明天海淀气温度数	Weather-Query
重播一下早上九点的健康之道	Radio-Listen
只将后天早上八点的闹钟关掉	Alarm-Update
第一时间打开烟雾报警器	HomeAppliance-Control
上个月的4号是周几	Calendar-Query
能否帮我看看泉州开过来的高铁哪天才有	Travel-Query
查看我国传统节日重阳节是几月几号啊	Calendar-Query
我要小小的空调风速	HomeAppliance-Control
这时候帮我打开风扇照明灯	HomeAppliance-Control
农历的哪天是关门节	Calendar-Query
今年的几月几号是宠物节	Calendar-Query
晚上9点建立提醒去拿发票	Alarm-Update
下午张家口有雨吗	Weather-Query
可以帮我找找今天播放的盛唐幻夜在哪个吗我想看下	TVProgram-Play
2号上午9点10分买眼镜的闹铃帮我开启一下吧。	Alarm-Update
美食纪录片人舌尖上的中国给我找一下	Video-Play
天气预报说明天要下雨别忘了明天提醒我带伞	Alarm-Update
今年的立春是几号	Calendar-Query
查询广西都市今天有什么好节目可以看	TVProgram-Play
